{
  "channel": "nipoto.support",
  "protocolVersion": "1.0",
  "instanceId": "01JINSTANCE0000000000001",
  "messageId": "01JMESSAGE00000000000017",
  "requestId": null,
  "type": "CONVERSATION_STATE_CHANGED",
  "sentAt": "2026-08-19T05:30:11.000Z",
  "payload": {
    "conversationId": "chat_123456",
    "state": "opened"
  }
}
