{
  "channel": "nipoto.support",
  "protocolVersion": "1.0",
  "instanceId": "01JINSTANCE0000000000001",
  "messageId": "01JMESSAGE00000000000019",
  "requestId": "01JREQUEST0000000000001",
  "type": "COMMAND_SUCCEEDED",
  "sentAt": "2026-08-19T05:30:00.100Z",
  "payload": {
    "command": "HOST_INIT"
  }
}
