{
  "channel": "nipoto.support",
  "protocolVersion": "1.0",
  "instanceId": "01JINSTANCE0000000000001",
  "messageId": "01JMESSAGE00000000000005",
  "requestId": "01JREQUEST0000000000005",
  "type": "MODULE_CLOSE",
  "sentAt": "2026-08-19T05:32:00.000Z",
  "payload": {
    "reason": "host-requested"
  }
}
