{
  "channel": "nipoto.support",
  "protocolVersion": "1.0",
  "instanceId": "01JINSTANCE0000000000001",
  "messageId": "01JMESSAGE00000000000006",
  "requestId": "01JREQUEST0000000000006",
  "type": "NAVIGATE",
  "sentAt": "2026-08-19T05:30:03.000Z",
  "payload": {
    "name": "conversation.view",
    "params": { "conversationId": "chat_123456" },
    "replace": false
  }
}
