{
  "channel": "nipoto.support",
  "protocolVersion": "1.0",
  "instanceId": "01JINSTANCE0000000000001",
  "messageId": "01JMESSAGE00000000000014",
  "requestId": null,
  "type": "MODULE_READY",
  "sentAt": "2026-08-19T05:29:59.000Z",
  "payload": {
    "moduleVersion": "0.0.0",
    "protocol": {
      "version": "1.0",
      "major": 1,
      "minMinor": 0,
      "maxMinor": 0
    },
    "nonce": "01JNONCE000000000000001",
    "capabilities": ["lifecycle", "session", "navigation"]
  }
}
