{
  "channel": "nipoto.support",
  "protocolVersion": "1.0",
  "instanceId": "01JINSTANCE0000000000001",
  "messageId": "01JMESSAGE00000000000007",
  "requestId": "01JREQUEST0000000000007",
  "type": "LOCALE_SET",
  "sentAt": "2026-08-19T05:30:04.000Z",
  "payload": {
    "locale": "en-US",
    "direction": "ltr"
  }
}
